<?xml version="1.0" encoding="UTF-8"?>
<psp:PSPReturn xmlns:psp="urn:cbn:psp:reporting:v1"
               xmlns:xsi="http://www.w3.org/2001/XMLSchema-instance"
               xsi:schemaLocation="urn:cbn:psp:reporting:v1 PSP_Return_Schema_v1.0.xsd"
               schemaVersion="1.0">

  <psp:Header>
    <psp:CBNLicenceNo>PSP/2024/00089</psp:CBNLicenceNo>
    <psp:PSPName>Sample Digital Payments Limited</psp:PSPName>
    <psp:ReturnType>TXN</psp:ReturnType>
    <psp:LicenceCategory>PSSP</psp:LicenceCategory>
    <psp:ReportingPeriodStart>2026-03-01</psp:ReportingPeriodStart>
    <psp:ReportingPeriodEnd>2026-03-31</psp:ReportingPeriodEnd>
    <psp:SubmissionDateTime>2026-04-05T10:00:00Z</psp:SubmissionDateTime>
    <psp:ContactPerson>Tunde Bakare</psp:ContactPerson>
    <psp:ContactEmail>compliance@sampledigital.com.ng</psp:ContactEmail>
  </psp:Header>

  <psp:TransactionVolumes>
    <psp:ChannelTransaction>
      <psp:ChannelName>Web Payment Gateway</psp:ChannelName>
      <psp:TransactionCount>4250000</psp:TransactionCount>
      <psp:TransactionValue>85000.00</psp:TransactionValue>
      <psp:SuccessRate>97.85</psp:SuccessRate>
      <psp:AvgTicketSize>20000.00</psp:AvgTicketSize>
    </psp:ChannelTransaction>
    <psp:ChannelTransaction>
      <psp:ChannelName>Mobile App Payments</psp:ChannelName>
      <psp:TransactionCount>6800000</psp:TransactionCount>
      <psp:TransactionValue>42500.00</psp:TransactionValue>
      <psp:SuccessRate>98.20</psp:SuccessRate>
      <psp:AvgTicketSize>6250.00</psp:AvgTicketSize>
    </psp:ChannelTransaction>
    <psp:ChannelTransaction>
      <psp:ChannelName>USSD Payments</psp:ChannelName>
      <psp:TransactionCount>2100000</psp:TransactionCount>
      <psp:TransactionValue>12600.00</psp:TransactionValue>
      <psp:SuccessRate>94.50</psp:SuccessRate>
      <psp:AvgTicketSize>6000.00</psp:AvgTicketSize>
    </psp:ChannelTransaction>
    <psp:ChannelTransaction>
      <psp:ChannelName>POS Terminal Transactions</psp:ChannelName>
      <psp:TransactionCount>3500000</psp:TransactionCount>
      <psp:TransactionValue>52500.00</psp:TransactionValue>
      <psp:SuccessRate>96.75</psp:SuccessRate>
      <psp:AvgTicketSize>15000.00</psp:AvgTicketSize>
    </psp:ChannelTransaction>
    <psp:ChannelTransaction>
      <psp:ChannelName>QR Code Payments</psp:ChannelName>
      <psp:TransactionCount>850000</psp:TransactionCount>
      <psp:TransactionValue>4250.00</psp:TransactionValue>
      <psp:SuccessRate>99.10</psp:SuccessRate>
      <psp:AvgTicketSize>5000.00</psp:AvgTicketSize>
    </psp:ChannelTransaction>

    <psp:TotalTransactions>17500000</psp:TotalTransactions>
    <psp:TotalValue>196850.00</psp:TotalValue>
    <psp:OverallSuccessRate>97.28</psp:OverallSuccessRate>
    <psp:FailedTransactions>476000</psp:FailedTransactions>
    <psp:PendingSettlement>1250.00</psp:PendingSettlement>
  </psp:TransactionVolumes>

  <psp:Signature>
    <psp:PreparedBy>
      <psp:Name>Chioma Nnadi</psp:Name>
      <psp:Designation>Head of Compliance &amp; Regulatory Affairs</psp:Designation>
      <psp:Date>2026-04-04</psp:Date>
    </psp:PreparedBy>
    <psp:MDSignOff>
      <psp:Name>Babajide Ogunleye</psp:Name>
      <psp:Designation>Managing Director / CEO</psp:Designation>
      <psp:Date>2026-04-05</psp:Date>
    </psp:MDSignOff>
    <psp:CertificationStatement>I/We certify that the information provided is true, accurate, and complete to the best of our knowledge and in compliance with CBN guidelines for Payment Service Providers.</psp:CertificationStatement>
  </psp:Signature>

</psp:PSPReturn>
